{"$schema":"https://json-schema.org/draft/2020-12/schema","$id":"https://agentropolis.local/schemas/sovereignty/hardware.schema.json","type":"array","items":{"type":"object","additionalProperties":false,"required":["id","name","location","networkBoundary"],"properties":{"id":{"type":"string","pattern":"^[a-z0-9][a-z0-9-]*$"},"name":{"type":"string"},"location":{"type":"string"},"networkBoundary":{"enum":["local","private","public-cloud"]}}}}
